{
  "schemaVersion": 1,
  "stepId": "0001",
  "repositoryRevision": "1111111111111111111111111111111111111111",
  "commandmentsSha256": "aaaaaaaaaaaaaaaaaaaaaaaaaaaaaaaaaaaaaaaaaaaaaaaaaaaaaaaaaaaaaaaa",
  "candidates": [
    {
      "id": "replace-public-command",
      "title": "Replace the public command name",
      "commandmentIds": ["CMD-002"],
      "evidence": [
        { "path": "README.md", "line": 10, "note": "The documented command uses the current public name." }
      ],
      "responseLayer": "code",
      "expectedGain": {
        "priority": "medium",
        "severity": "low",
        "recurrence": "low",
        "preventionValue": "low",
        "confidence": "high"
      },
      "riskCost": {
        "implementationCost": "medium",
        "blastRadius": "high",
        "uncertainty": "medium",
        "rollbackDifficulty": "medium"
      },
      "eligibility": {
        "eligible": false,
        "rejectionReasons": ["hard-commandment-conflict"]
      },
      "verificationPlan": ["Run the documented command through the protected user path."],
      "rollback": "Restore the original command and its documentation.",
      "potetoPlaybook": "pstack/skills/poteto-mode/playbooks/feature.md",
      "behavioralEval": "not-required"
    }
  ],
  "selectedCandidateId": null,
  "rankingSummary": "No candidate clears every eligibility gate.",
  "controllerReceipt": {
    "recordedAt": "2026-08-28T12:25:00Z",
    "inputSha256": "bbbbbbbbbbbbbbbbbbbbbbbbbbbbbbbbbbbbbbbbbbbbbbbbbbbbbbbbbbbbbbbb"
  }
}
